{
  "schema": "liblevenshtein.pure-rust-legacy-java-pair.v1",
  "replicate": 22,
  "mode": "construct",
  "run_config_sha256": "f5352c69a90dbf765567b359cbfa305bae5f0bc98a881d4852f5887ac59170e3",
  "exact_signature_equal": true,
  "signature": {
    "semantic_checksum_hex": "8da9c6f99f82a731",
    "semantic_membership_checks": 79343,
    "semantic_term_count": 79343,
    "term_count": 79343
  },
  "rust": {
    "raw_file": "rust.json",
    "raw_sha256": "ff9b92d5e8fdc7798eb41007823eccea8c39ab082dfe57f8bfe94c381a12a7a5",
    "elapsed_ns": 13848931
  },
  "java": {
    "raw_file": "java.json",
    "raw_sha256": "f07445dddfa8b24ef65911ea658bba51231d00920532e2af7daea9b388033d29",
    "elapsed_ns": 167674309
  }
}
