{
  "schema": "liblevenshtein.pure-rust-legacy-java-pair.v1",
  "replicate": 6,
  "mode": "construct",
  "run_config_sha256": "f5352c69a90dbf765567b359cbfa305bae5f0bc98a881d4852f5887ac59170e3",
  "exact_signature_equal": true,
  "signature": {
    "semantic_checksum_hex": "8da9c6f99f82a731",
    "semantic_membership_checks": 79343,
    "semantic_term_count": 79343,
    "term_count": 79343
  },
  "rust": {
    "raw_file": "rust.json",
    "raw_sha256": "c60aff038f8e7864a26afbe638001818d5df1efea3cf683f8a5605c1a923020e",
    "elapsed_ns": 13643651
  },
  "java": {
    "raw_file": "java.json",
    "raw_sha256": "f82cb7a668364741cf370e6167d9b4121224fb798948c5ea78342aa0a35f394b",
    "elapsed_ns": 162279226
  }
}
