{
  "schema": "liblevenshtein.pure-rust-legacy-java-pair.v1",
  "replicate": 2,
  "mode": "query",
  "run_config_sha256": "08f5430890f7b2efe2b21caeb2187f6588808414fd7359792da9734a4b705708",
  "exact_signature_equal": true,
  "signature": {
    "checksum_hex": "3bdc59281f42611a",
    "distance_sum_per_pass": 2620,
    "matches_per_pass": 3620,
    "term_bytes_per_pass": 24726
  },
  "rust": {
    "raw_file": "rust.json",
    "raw_sha256": "bb04e3aa54c32b5c38214c857a296b89c381e72f18a049f0ccaddc9e9cc19334",
    "elapsed_ns": 14420074
  },
  "java": {
    "raw_file": "java.json",
    "raw_sha256": "703c3bcded8f67a88ad0a14ef3d01447f6288d000fff7226f76d6f3fd5a8d536",
    "elapsed_ns": 45576843
  }
}
