{
  "schema": "liblevenshtein.pure-rust-legacy-java-pair.v1",
  "replicate": 14,
  "mode": "construct",
  "run_config_sha256": "48cbc2d2007e4de53f0785f46ab76072797a2281a2bf152a22356d2ed9df4f78",
  "exact_signature_equal": true,
  "signature": {
    "semantic_checksum_hex": "8da9c6f99f82a731",
    "semantic_membership_checks": 79343,
    "semantic_term_count": 79343,
    "term_count": 79343
  },
  "rust": {
    "raw_file": "rust.json",
    "raw_sha256": "23fa53d67a5ad6ace18bde77c43ccd7c114e763d0e06bd799583c4f115ed7f45",
    "elapsed_ns": 17964898
  },
  "java": {
    "raw_file": "java.json",
    "raw_sha256": "93a3df13afb4fcd77cb0f21986f3dfe81742a4a56dd29930fac37e2d91a7c70c",
    "elapsed_ns": 184203766
  }
}
