{
  "schema": "liblevenshtein.pure-rust-legacy-java-pair.v1",
  "replicate": 33,
  "mode": "query",
  "run_config_sha256": "08f5430890f7b2efe2b21caeb2187f6588808414fd7359792da9734a4b705708",
  "exact_signature_equal": true,
  "signature": {
    "checksum_hex": "3bdc59281f42611a",
    "distance_sum_per_pass": 2620,
    "matches_per_pass": 3620,
    "term_bytes_per_pass": 24726
  },
  "rust": {
    "raw_file": "rust.json",
    "raw_sha256": "798dfdd5367d5833b5b22e10117fc62963215fabebcabb5f5cbc9bf05e99417b",
    "elapsed_ns": 14199691
  },
  "java": {
    "raw_file": "java.json",
    "raw_sha256": "0769ee4907f15797e5d531841d87c989eb19aade9f0c7a80a640e1ed10ce610f",
    "elapsed_ns": 46890872
  }
}
