{
  "schema": "liblevenshtein.pure-rust-legacy-java-pair.v1",
  "replicate": 23,
  "mode": "construct",
  "run_config_sha256": "48cbc2d2007e4de53f0785f46ab76072797a2281a2bf152a22356d2ed9df4f78",
  "exact_signature_equal": true,
  "signature": {
    "semantic_checksum_hex": "8da9c6f99f82a731",
    "semantic_membership_checks": 79343,
    "semantic_term_count": 79343,
    "term_count": 79343
  },
  "rust": {
    "raw_file": "rust.json",
    "raw_sha256": "251cf896fddf65e80681ef9b2b2f23eb33b0d76119acc3e33d40887a3b1336ae",
    "elapsed_ns": 17178659
  },
  "java": {
    "raw_file": "java.json",
    "raw_sha256": "240ffaac0fd2afd8cdd8b7693584f8dbeeb78d40ab375d3f494aa5b784745915",
    "elapsed_ns": 174607965
  }
}
