{
  "schema": "liblevenshtein.pure-rust-legacy-java-pair.v1",
  "replicate": 48,
  "mode": "query",
  "run_config_sha256": "08f5430890f7b2efe2b21caeb2187f6588808414fd7359792da9734a4b705708",
  "exact_signature_equal": true,
  "signature": {
    "checksum_hex": "3bdc59281f42611a",
    "distance_sum_per_pass": 2620,
    "matches_per_pass": 3620,
    "term_bytes_per_pass": 24726
  },
  "rust": {
    "raw_file": "rust.json",
    "raw_sha256": "d0fefc1e81901c44345f7bf36630e33d2155488d725a3e922bbfa4317ef79b80",
    "elapsed_ns": 14112507
  },
  "java": {
    "raw_file": "java.json",
    "raw_sha256": "bfe83ef21213694d46c63b0bc180236aae28eb2503d8484d40b45156340f6d57",
    "elapsed_ns": 49275917
  }
}
