{
  "schema": "liblevenshtein.pure-rust-legacy-java-pair.v1",
  "replicate": 31,
  "mode": "construct",
  "run_config_sha256": "48cbc2d2007e4de53f0785f46ab76072797a2281a2bf152a22356d2ed9df4f78",
  "exact_signature_equal": true,
  "signature": {
    "semantic_checksum_hex": "8da9c6f99f82a731",
    "semantic_membership_checks": 79343,
    "semantic_term_count": 79343,
    "term_count": 79343
  },
  "rust": {
    "raw_file": "rust.json",
    "raw_sha256": "c284d56ac06629e803ec8175979ecf371786e1caeb40d0225b30f947d6726758",
    "elapsed_ns": 16931941
  },
  "java": {
    "raw_file": "java.json",
    "raw_sha256": "6adef5ba75dd720aabebf9ef281a6fa34bf829d82c6d217318552378cbe805a5",
    "elapsed_ns": 169664459
  }
}
