{
  "schema": "liblevenshtein.pure-rust-legacy-java-pair.v1",
  "replicate": 24,
  "mode": "construct",
  "run_config_sha256": "f5352c69a90dbf765567b359cbfa305bae5f0bc98a881d4852f5887ac59170e3",
  "exact_signature_equal": true,
  "signature": {
    "semantic_checksum_hex": "8da9c6f99f82a731",
    "semantic_membership_checks": 79343,
    "semantic_term_count": 79343,
    "term_count": 79343
  },
  "rust": {
    "raw_file": "rust.json",
    "raw_sha256": "4084e8c991806ebb94f2aae8f889e5aa2aaddcecc3191a1e379cffe88741ffc8",
    "elapsed_ns": 14047858
  },
  "java": {
    "raw_file": "java.json",
    "raw_sha256": "3a8019ad2519ce56f292edb43380d8f4ad7b54862efe3595b00f43b610eed976",
    "elapsed_ns": 177800289
  }
}
