{
  "schema": "liblevenshtein.pure-rust-legacy-java-pair.v1",
  "replicate": 9,
  "mode": "construct",
  "run_config_sha256": "f5352c69a90dbf765567b359cbfa305bae5f0bc98a881d4852f5887ac59170e3",
  "exact_signature_equal": true,
  "signature": {
    "semantic_checksum_hex": "8da9c6f99f82a731",
    "semantic_membership_checks": 79343,
    "semantic_term_count": 79343,
    "term_count": 79343
  },
  "rust": {
    "raw_file": "rust.json",
    "raw_sha256": "e44ef94ae7c9222d18016761376bafb771d4dab9d0fae215afbda03ad8d9f25d",
    "elapsed_ns": 13681242
  },
  "java": {
    "raw_file": "java.json",
    "raw_sha256": "2038956549c6bd3e9495203cd8399ae88160fca89312e3b24e72d7551e9f4d48",
    "elapsed_ns": 199771330
  }
}
