{
  "schema": "liblevenshtein.pure-rust-legacy-java-pair.v1",
  "replicate": 50,
  "mode": "construct",
  "run_config_sha256": "f5352c69a90dbf765567b359cbfa305bae5f0bc98a881d4852f5887ac59170e3",
  "exact_signature_equal": true,
  "signature": {
    "semantic_checksum_hex": "8da9c6f99f82a731",
    "semantic_membership_checks": 79343,
    "semantic_term_count": 79343,
    "term_count": 79343
  },
  "rust": {
    "raw_file": "rust.json",
    "raw_sha256": "cfefca4d3846ebab50dbb707b3107889c54e2a56ef0755cad3d6d7f377fad242",
    "elapsed_ns": 13817580
  },
  "java": {
    "raw_file": "java.json",
    "raw_sha256": "07a3534d5a4424ffb6730c36ffc416a9106dadc2c50c7dcb994570ab19b69204",
    "elapsed_ns": 165791503
  }
}
