{
  "schema": "liblevenshtein.pure-rust-legacy-java-pair.v1",
  "replicate": 41,
  "mode": "construct",
  "run_config_sha256": "f5352c69a90dbf765567b359cbfa305bae5f0bc98a881d4852f5887ac59170e3",
  "exact_signature_equal": true,
  "signature": {
    "semantic_checksum_hex": "8da9c6f99f82a731",
    "semantic_membership_checks": 79343,
    "semantic_term_count": 79343,
    "term_count": 79343
  },
  "rust": {
    "raw_file": "rust.json",
    "raw_sha256": "4499b9686d5041fb70cb7b92bf56a5f9592ec22ec6211a8f67e19c59eae773d0",
    "elapsed_ns": 13933537
  },
  "java": {
    "raw_file": "java.json",
    "raw_sha256": "25699b239db9133264e7398d374850684a15b8e34d1c7627c2e4a7bed80dd4aa",
    "elapsed_ns": 165177259
  }
}
