{
  "schema": "liblevenshtein.pure-rust-legacy-java-pair.v1",
  "replicate": 48,
  "mode": "construct",
  "run_config_sha256": "48cbc2d2007e4de53f0785f46ab76072797a2281a2bf152a22356d2ed9df4f78",
  "exact_signature_equal": true,
  "signature": {
    "semantic_checksum_hex": "8da9c6f99f82a731",
    "semantic_membership_checks": 79343,
    "semantic_term_count": 79343,
    "term_count": 79343
  },
  "rust": {
    "raw_file": "rust.json",
    "raw_sha256": "c75782738ab58c8a8bfce44f74198aa05a39c055a468ea5a529cfb3d560e691a",
    "elapsed_ns": 16960305
  },
  "java": {
    "raw_file": "java.json",
    "raw_sha256": "d8a51b8f84d16c0a5623817f34a0d057aed259f3dd4643e1bb9ac9299c675c4c",
    "elapsed_ns": 171181102
  }
}
