{
  "schema": "liblevenshtein.pure-rust-legacy-java-pair.v1",
  "replicate": 10,
  "mode": "query",
  "run_config_sha256": "08f5430890f7b2efe2b21caeb2187f6588808414fd7359792da9734a4b705708",
  "exact_signature_equal": true,
  "signature": {
    "checksum_hex": "3bdc59281f42611a",
    "distance_sum_per_pass": 2620,
    "matches_per_pass": 3620,
    "term_bytes_per_pass": 24726
  },
  "rust": {
    "raw_file": "rust.json",
    "raw_sha256": "6cb2baf4b530c314b000b9734e8d6ce6695431cb69aed2586b607275ea27118e",
    "elapsed_ns": 14120946
  },
  "java": {
    "raw_file": "java.json",
    "raw_sha256": "b73849128dd7e611bc5854a15ab1e575874b16e7ebf99b29d2371e2cf02599b3",
    "elapsed_ns": 47273101
  }
}
