{
  "schema": "liblevenshtein.pure-rust-legacy-java-pair.v1",
  "replicate": 36,
  "mode": "query",
  "run_config_sha256": "08f5430890f7b2efe2b21caeb2187f6588808414fd7359792da9734a4b705708",
  "exact_signature_equal": true,
  "signature": {
    "checksum_hex": "3bdc59281f42611a",
    "distance_sum_per_pass": 2620,
    "matches_per_pass": 3620,
    "term_bytes_per_pass": 24726
  },
  "rust": {
    "raw_file": "rust.json",
    "raw_sha256": "5f032949ee2a1c3a499b0104eb0e7102c267dd90590a6bc19487be81486be4bb",
    "elapsed_ns": 14357731
  },
  "java": {
    "raw_file": "java.json",
    "raw_sha256": "831c6788455bd6257f89b105fcc672005edc58b6e2267925580b3b6a5248f471",
    "elapsed_ns": 50063746
  }
}
